"<p>You need to ETL streaming data from web server logs as it is streamed in, for analysis in Athena. Upon talking to the stakeholders, you’ve determined that the ETL does not strictly need to happen in real-time, but transforming the data within a minute is desirable. </p><p>What is a viable solution to this requirement?</p>",multiple-choice,"<p>Create an AWS Glue ETL job, and schedule it to run every minute.</p>","<p>Perform any initial ETL you can using Amazon Kinesis, store the data in S3, and trigger a Glue ETL job to complete the transformations needed.</p>","<p>Publish your data into DynamoDB, and use DynamoDB streams together with AWS Glue to perform the ETL.</p>","<p>Perform any initial ETL you can with Kinesis Analytics, and send the output of Kinesis Analytics directly to a Spark Streaming application to handle the remaining transformations.</p>",,,2,"Glue jobs can be scheduled at a minimum of 5 minutes, ruling out “a”. Glue does not integrate directly with DynamoDB, ruling out “c”. Kinesis Analytics cannot connect directly to Spark Streaming, ruling out “d”. “B” is the recommended approach from AWS. An alternative approach would be to use Kinesis Firehose and a Lambda function to transform the data before storing it in S3.",
"<p>Your company wishes to monitor social media, and perform sentiment analysis on Tweets to classify them as positive or negative sentiment. You are able to obtain a data set of past Tweets about your company to use as training data for a machine learning system, but they are not classified as positive or negative.</p><p>How would you build such a system?</p>",multiple-choice,"<p>Use Amazon Mechanical Turk to label past Tweets as positive or negative, and use those labels to train a neural network on an EMR cluster.</p>","<p>Use Amazon Machine Learning with a binary classifier to assign positive or negative sentiments to the past Tweets, and use those labels to train a neural network on an EMR cluster.</p>","<p>Stream both old and new tweets into an Amazon Elasticsearch Service cluster, and use Elasticsearch machine learning to classify the tweets.</p>",<p>Use RANDOM_CUT_FOREST to automatically identify negative tweets as outliers.</p>,,,1,"A machine learning system needs labeled data to train itself with; there’s no getting around that. Only option “a” produces the positive or negative labels we need, by using humans to create that training data initially. Another solution would be to use natural language processing through a service such as Amazon Comprehend, but we don’t expect you to see Comprehend on the exam yet.",
"<p>Your team has developed a Spark Streaming applications that performs real time transformations on an on-premise Apache Kafka cluster and finally delivers the data in real time to S3. As part of a migration to the cloud and switch to Kinesis as an underlying streaming store, what do you recommend?</p>",multiple-choice,"<p>Produce data using Spark Streaming to Kinesis Data Streams, and read the data with Spark Streaming from Kinesis Data Firehose to write it to S3.</p>","<p>Produce data using Spark Streaming to Kinesis Data Streams, and read the data with Spark Streaming from Kinesis Data Streams to write it to S3.</p>",<p>Produce data using Spark Streaming to Kinesis Data Firehose and deliver the data to S3 using Kinesis Data Firehose.</p>,<p>Produce data using Spark Streaming to Kinesis Data Firehose and deliver the data to S3 using Spark Streaming reading from Kinesis Data Streams.</p>,,,2,"Here, the key requirement is the real-time constraint. Kinesis Data Firehose is “near real time” (60 seconds minimum batch size) and thus cannot be used for delivery to S3 in real time. Finally, Spark Streaming can read and write to Kinesis Data Streams only.",
"<p>Your financial organization has hundreds of Terabytes of data stored within its on premise data centers, and data is being produced at the rate of Gigabytes per second, and could be consumed within 3 days. As part of their AWS cloud migration, what solution do you recommend for them?</p>",multiple-choice,<p>Install Direct Connect between your data center and AWS and transfer all the data over a 10Gbps line. Use Kinesis Data Streams for ongoing data collection.</p>,<p>Install Direct Connect between your data center and AWS and transfer all the data over a 10Gbps line. Use Kinesis Data Firehose for ongoing data collection.</p>,<p>Transfer your historical data using Snowball and use Kinesis Data Firehose for ongoing data collection.</p>,<p>Transfer your historical data using Snowball and use Kinesis Data Streams for ongoing data collection.</p>,,,4,"As your organization has hundreds of Terabytes of data, it is going to be much quicker and much more efficient to use Snowball to transport that data to AWS. As the data streams must be stored for at least 3 days, you must use Kinesis Data Streams which has a configurable data retention of between 1 and 7 days.",
<p>You are dealing with PII datasets and would like to leverage Kinesis Data Streams for your pub-sub solution. Regulators imposed the constraint that the data must be encrypted end-to-end using an internal key management system. What do you recommend?</p>,multiple-choice,<p>Enable KMS encryption at rest for Kinesis and transfer the data over HTTPS to get in-flight encryption</p>,<p>Encrypt the data with the MD5 algorithm before pushing it to Kinesis</p>,<p>Use the Kinesis Client Library (KCL) to encrypt the data</p>,<p>Implement a custom encryption code in the Kinesis Producer Library (KPL)</p>,,,4,"We cannot use KMS as we cannot leverage an internal key management system. MD5 is not an encryption algorithm and encryption must happen at the producer level (KPL), while decryption will happen at the consumption level (KCL).",
"<p>As an e-commerce retailer, you would like to onboard clickstream data onto Kinesis from your web servers Java applications. You want to ensure that a retry mechanism is in place, as well as good batching capability and asynchronous mode. You also want to collect server logs with the same constraints. What do you recommend?</p>",multiple-choice,<p>Use the AWS Kinesis SDK for Java in your web servers and use Kinesis Producer Library to collect server logs</p>,<p>Use Kinesis Producer Library to send the click stream and collect the server logs.</p>,<p>Use the Kinesis Producer Library to send the clickstream and the Kinesis agent to collect the Server Logs</p>,<p>Use the Kinesis Agent to send the click stream and collect the server logs.</p>,,,3,"The KPL has the mechanisms in place for retry and batching, as well as asynchronous mode. The Kinesis agent is meant to retrieve server logs with just configuration files.",
"<p>You would like to process data coming from IoT devices, and processing that date takes approximately 2 minutes per data point. You would also like to be able to scale in terms of number of processes that will consume that data, based on the load your are receiving, and no ordering constraints are required. What do you recommend?</p>",multiple-choice,<p>Define an IoT rules actions to send data to Kinesis Data Streams and consume the data with KCL</p>,<p>Define an IoT rules actions to send data to Kinesis Data Streams and consume the data with AWS Lambda</p>,<p>Define an IoT rules actions to send data to SQS and consume the data with EC2 instances in an Auto Scaling group</p>,<p>Define an IoT rules actions to send data to Kinesis Data Firehose and consume with AWS Lambda</p>,,,3,"Here the lack of ordering and the fact the processing may be long, and needs to scale based on the number of messages make SQS a better fit for this than Kinesis Data Streams, that on top of it will be more cost efficient. ",
"<p>You are working for an e-commerce website and that website uses an on-premise PostgreSQL database as its main OLTP engine. You would like to perform analytical queries on it, but the Solutions Architect recommended not doing it off of the main database. What do you recommend?</p>",multiple-choice,<p>Create an RDS Read Replica</p>,<p>Create an on-premise PostgreSQL Read Replica</p>,<p>Create an Aurora Read Replica</p>,<p>Use DMS to replicate the database to RDS</p>,,,4,Read Replicas cannot be instantiated from an on-premise database. Here using a solution like DMS (Database Migration Service) is the right way to replicate the database state. ,
"<p>Your enterprise would like to leverage AWS Redshift to query data. Currently that data is produced at the rate of 5 PB of historical data and another 3 TB per month that you would like to get with less than two days delay, and you are tasked with finding the most efficient data transfer solution into S3. What do you recommend? (select two)</p>",multi-select,<p>Establish Direct Connect and transfer the historical data over a 10Gpbs connection</p>,<p>Establish Site-to-Site VPN and transfer the historical data over a public 10Gbps connection.</p>,<p>Use Snowball to transfer the historical data</p>,<p>Use Snowball to transfer the newly created monthly data</p>,<p>Establish Direct Connect and do a daily upload newly created monthly data directly into S3</p>,,"3,5","Snowball is the only way to transfer your historical data as it would take a very long time to transfer over the network, even with Direct Connect or Site-to-Site VPN. For ongoing data, it’s the equivalent of 300 GB a day, which will take less than an hour to upload each day, versus Snowball which will definitely take longer than 2 days to reach AWS.",
<p>You are working for a bank and your company is regularly uploading 100 MB files to Amazon S3 and analyzed by Athena. It has come to light that recently some of the uploads have been corrupted and made a critical big data job fails. Your company would like a stronger guarantee that uploads are done successfully and that the files have the same content on premise and on S3. It looks to do so at minimal cost. What do you recommend?</p>,multiple-choice,<p>Use the S3 ETag and compare to the local MD5 hash</p>,<p>Download the data from S3 after uploading it and compare the SHA-1 signature</p>,<p>Upload a hash header as part of the S3 metadata which will trigger an S3 failure upon server side check for corruption</p>,<p>Transfer the data over HTTP with gzip compression enabled</p>,,,1,"Here the S3 tag will compute the MD5 hash of the file on the server and this can be used to compare it to the local MD5 hash of the file that has been uploaded. Downloading data back from S3 might work, but will be way too costly. There’s no feature to upload a hash header to S3 and transferring the data on HTTP will not help, and will decrease security. ",
"<p>You are creating an EMR cluster that will process the data in several MapReduce steps. Currently you are working against the data in S3 using EMRFS, but the network costs are extremely high as the processes write back temporary data to S3 before reading it. You are tasked with optimizing the process and bringing the cost down, what should you do?</p>",multiple-choice,<p>Enable LUKS encryption</p>,<p>Add a preliminary step that will use a S3DistCp command</p>,<p>Enable EMRFS local caching feature</p>,<p>Use I3 type of instances</p>,,,2,"Here, using an S3DistCp command is the right thing to do to copy data from S3 into HDFS and then make sure the data is processed locally by the EMR cluster MapReduce job. Upon completion, you will use S3DistCp again to push back the final result data to S3. LUKS encryption will not help, EMRFS does not have a local caching feature, and changing the EC2 instance types won’t help",
<p>You are looking to reduce the latency down from your Big Data processing job that operate in Singapore but source data from Virginia. The Big Data job must always operate against the latest version of the data. What do you recommend?</p>,multiple-choice,<p>Create a Data Pipeline job to transfer the data regularly between two S3 buckets located in different regions</p>,<p>Enable S3 Cross Region Replication</p>,<p>Install a CloudFront distribution on top of your S3 bucket</p>,<p>Use S3 Transfer Acceleration</p>,,,2,"Here to reduce the latency you must move the data to another S3 bucket. The DataPipeline job may work but won’t be able to replicate the latest data continuously, and CloudFront will cache some data and may provide outdated data to the Big Data Job. S3 Transfer acceleration will not help. Here, you must enable S3 Cross Region Replication",
"<p>You have an ETL process that collects data from different sources and 3rd party providers and would like to ensure that data is loaded into Redshift once all the parts from all the providers related to one specific jobs have been gathered, which is the process that can happen over the course of one hour to one day. What the least costly way of doing that?</p>",multiple-choice,<p>Load data in Redshift regularly using a Lambda cron job into a temporary table and use Redshift database triggers to assemble the final data when all the parts are ready.</p>,<p>Create an AWS Lambda that responds to S3 upload events and will check if all the parts are there before uploading to Redshift</p>,<p>Use the multi part upload feature of S3 to collect data from different sources</p>,<p>Create a Kinesis Data Firehose pipeline and program a Python condition that will trigger a buffer flush upon receiving all the necessary parts</p>,,,2,Loading the data in Redshift will be costly and inefficient and Redshift does not support database triggers. Multi Part is not helpful for data coming from various sources. Kinesis Firehose does not have a Python condition for buffer flush (only time and size). Here a Lambda function that reacts to events happening in S3 is the right answer. ,
"<p>Your company collects data from various sources into Kinesis and the stream is delivered using Kinesis Data Firehose into S3. Once in S3, your data scientist team uses Athena to query the most recent data, and usage has shown that after a month, the team queries the data less and less, and finally after two months does not use it. For regulatory reasons, it is required to keep all the data for 5 years and no one should be able to delete it. What do you recommend? (select two)</p>",multi-select,<p>Create a lifecycle rule to migrate the data to S3 IA after 30 days and Glacier after 60 days.</p>,<p>Create a lifecycle rule to migrate the data to S3 Athena one day 1 and S3 Athena IA after 30 days.</p>,<p>Create a lifecycle rule to migrate all the data to S3 IA after 30 days and delete the data after 60 days. Create a rule to have a replica of all source data into Glacier from the first day.</p>,<p>Implement a Glacier Vault Lock Policy</p>,<p>Implement a Glacier Vault Access Policy</p>,,"3,4","S3 Athena is not a storage class. Data should be moved to S3 IA after 30 days. If the data is moved to Glacier after 60 days, then there are no guarantees for it not to be deleted by anyone for the first 60 days. Hence a replica of the data should be delivered to Glacier right away. Finally, to prevent deletion in Glacier, you must use a Glacier Vault Lock Policy. ",
"<p>You are processing data using a long running EMR cluster and you like to ensure that you can recover data in case an entire availability zone goes down, as well as process the data locally for the various Hive jobs you plan on running. What do you recommend to do this at a minimal cost?</p>",multiple-choice,<p>Store the data in S3 and keep a warm copy in HDFS</p>,<p>Store the data in HDFS and mirror it to another EMR cluster in another region</p>,<p>Store the data in S3 and directly perform Hive jobs against it</p>,<p>Enable regular EBS backups</p>,,,1,"EBS backups will be expensive and very painful to deal with as the dataset will be distributed over many different snapshots due to HDFS block replication mechanisms. Storing all the data in S3 and none in HDFS will incur some extra costs as the data is constantly read and written back to S3. It’s better to keep a local copy on HDFS. Finally, maintaining an entirely new EMR cluster for disaster recovery is too expensive. ",
"<p>Your daily Spark jobs runs against files created by a Kinesis Firehose pipeline in S3. Due to a low throughput, you observe that each of the many files created by Kinesis Firehose is about 100KB. You would like to optimise your Spark job as best as possible to query the data efficiently. What do you recommend?</p>",multiple-choice,<p>Consolidate files on a daily basis using DataPipeline</p>,<p>Compress the files using GZIP</p>,<p>Increase the batch flush time in Kinesis Data Firehose to 1 hour.</p>,<p>Use multi-part download with Spark.</p>,,,1,"Multi part download is not a Spark feature, which does not deal well with many small files. GZIP will not solve the problems, the files will still be small and you will have many of them. Kinesis Data Firehose does not have a flush time greater than 5 minutes, which will still create many small files. Bottom line, you should use a DataPipeline job to consolidate the files on a daily basis into a larger file.",
<p>You are collecting data from various IoT thermostat and would like to have the data in S3 to ensure you can perform analytics on it using Hive running on EMR. The data scientists will use Hive to query the data based on a date range and will need to delete the data in S3 regularly if it becomes out of date to save cost. What do you recommend for the storage strategy in S3?</p>,multiple-choice,<p>&lt;device-id&gt;/&lt;YYYY&gt;/&lt;MM&gt;/&lt;DD&gt;</p>,<p>&lt;YYYY&gt;/&lt;MM&gt;/&lt;DD&gt;/&lt;device-id&gt;/</p>,<p>All the data at the root of your S3 bucket</p>,<p>&lt;DD&gt;/&lt;MM&gt;/&lt;YYYY&gt;/&lt;device-id&gt;/</p>,,,2,"As all the data will often get queried and deleted based on a date range, it’s much better to use a date as the root key for your S3 objects. Starting with the year is better as it will allow you to query based on years efficiently. ",
"<p>You work for a gaming company and each game’s data is stored in DynamoDB tables. In order to provide a game search functionality to your users, you need to move that data over to ElasticSearch. How can you achieve it efficiently and as close to real time as possible?</p>",multiple-choice,<p>Enable DynamoDB Streams and connect it with Kinesis Data Firehose</p>,<p>Enable DynamoDB Streams and write a Lambda function</p>,<p>Create a DataPipeline job scheduled on an hourly basis</p>,<p>Use DynamoDB Global Replication and select ElasticSearch Service as your target.</p>,,,2,"DynamoDB Streams do not have direct integration with Firehose, DataPipeline will not have the data fast enough into ElasticSearch, and DynamoDB Global Tables do not integrate with ElasticSearch. Here we need to write a Lambda function that is triggered from a DynamoDB Stream",
<p>You are looking to query data storage in DynamoDB from your EMR cluster. Which of the following technology will allow you to do so?</p>,multiple-choice,<p>Spark</p>,<p>HBase</p>,<p>Pig</p>,<p><strong>Hive</strong></p>,,,4,"Amongst the four listed above, Hive can have DynamoDB as a source for its queries. ",
"<p>You are storing gaming data for your game that is becoming increasingly popular. An average game data will contain 80KB of data and as your games are quick. You expect about 400 games to be written per second to your database. Additionally, a lot of people would like to retrieve this game data and you expect about 1800 eventually consistent reads per second. How should you provision your DynamoDB table?</p>",multiple-choice,<p>32000 WCU &amp; 144000 RCU</p>,<p>32000 WCU &amp; 36000 RCU</p>,<p>3200 WCU &amp; 36000 RCU</p>,<p>32000 WCU &amp; 18000 RCU</p>,,,4,1 WCU = 1 KB / s so we need 80KB * 400 / s = 32000 WCU. 1 RCU = 2 eventually consistent reads per second of 4 KB so we need 1800 * 80 / 8 = 18000 RCU.,
<p>You are an online retailer and your website is a storefront for millions of products. You have recently run a big sale on one specific electronic and you have encountered Provisioned Throughput Exceptions. You would like to ensure you can properly survive an upcoming sale that will be three times as big. What do you recommend?</p>,multiple-choice,<p>Enable DynamoDB Streams</p>,<p>Enable DynamoDB DAX</p>,<p>Triple the provisioned RCU</p>,<p>Triple the provisioned WCU</p>,,,2,"Here we are in a hot partition situation where one item is constantly being requested. Adding RCU will be costly and won’t be effective as even though we have tripled the table capacity, the one partition will still experience throughput exceptions. Enabling DynamoDB Streams will not help, but a DAX cluster will provide caching for hot items and will definitely help in this situation.",
"<p>You are deploying your web servers being a Load Balancer. The Load Balancer is in a public subnet and the web servers sit in a private subnet. For security reasons, the private subnet does not have access to internet and you would like to ensure the web servers within this subnet have access to DynamoDB. What do you recommend?</p>",multiple-choice,<p>Create an Internet Gateway in the public subnet</p>,<p>Enable Direct Connect between your VPC and DynamoDB</p>,<p>Provision a VPC Endpoint Gateway</p>,<p>Create a DynamoDB table within your VPC and attach a security group to it authorizing traffic from your EC2 instances.</p>,,,3,"An internet gateway will work but will break the security in place. Direct Connect only helps connecting on premise data centers to AWS VPC. DynamoDB tables cannot be provisioned within a VPC. So you need to create a VPC Endpoint of type Gateway (please note they’re not Interfaces, they’re gateway). ",
<p>You would like to design an application that will be able to sustain storing 100s of TB of data in a database that will get low latency on reads and won’t require you to manage scaling. What do you recommend?</p>,multiple-choice,<p>Redshift</p>,<p>DynamoDB</p>,<p>Aurora</p>,<p>ElastiCache</p>,,,2,"Redshift cannot be used for low latency reads, Aurora will not scale past 64 TB and ElastiCache most likely won’t scale and require you to manage scaling anyway. DynamoDB complies with the requirements and has built-in support for auto scaling. ",
"<p>As part of your application development, you would like your users to be able to get Row Level Security. The application is to be deployed on web servers and the users of the application should be able to use their amazon.com accounts. What do you recommend for the database and security?</p>",multiple-choice,<p>Enable Web Identity federation. Use DynamoDB and reference ${aws:username} in the attached IAM policy</p>,<p>Enable Web Identity federation. Use DynamoDB and reference ${www.amazon.com:user_id} in the attached IAM policy</p>,<p>Enable Web Identity federation. Use RDS and reference ${aws:username} in the attached IAM policy</p>,<p>Enable Web Identity federation. Use RDS and reference ${www.amazon.com:user_id} in the attached IAM policy</p>,,,2,"RDS does not allow authorization through IAM policies, so we have to rule out RDS as a database technology for our purpose. DynamoDB is the technology of choice. As we’re using Web Identity Federation with amazon.com, our IAM policy should use the ${www.amazon.com:user_id} policy variable",
"<p>As part of an effort to limit cost and maintain under control the size of your DynamoDB table, your ÅWS account manager would like to ensure old data is deleted in DynamoDB after 1 month. How can you do so with as little maintenance as possible and without impacting the current read and write operations?</p>",multiple-choice,<p>Create a lifecycle rule to delete your items after 30 days</p>,<p>Create a Lambda function that gets triggered on a daily basis</p>,<p>Scan your table from EMR and issue a delete statement afterwards</p>,<p>Enable DynamoDB TTL and add a TTL column</p>,,,4,"Lifecycle rules do not exist on DynamoDB, and a Lambda function would require maintenance and add load on the WCU as you delete items. So will an EMR scan. The TTL will automatically expire old items and will not affect your usage of WCU and RCU upon item deletion. ",
<p>What security mechanisms are supported by EMR? (Select three)</p>,multi-select,<p>LUKS encryption</p>,<p>KMS encryption</p>,<p>External HSM encryption</p>,<p>SSE-C</p>,<p>Transparent Data Encryption (TDE)</p>,<p>SSE-KMS</p>,"1,2,6",https://aws.amazon.com/blogs/big-data/best-practices-for-securing-amazon-emr/ ,
"<p>You have an S3 bucket that your entire organization can read. For security reasons you would like the data sits encrypted there and you would like to define a strategy in which users can only read the data which they are allowed to decrypt, which may be a different partial set of objects within the bucket for each user. How can you achieve that?</p>",multiple-choice,<p>Use SSE-KMS to encrypt the files</p>,<p>Use SSE-S3 to encrypt the files</p>,<p>Change the bucket policy</p>,<p>Use identity federation</p>,,,1,"Here, the key is that users should be able to decrypt different files based on their rights. Bucket policies do not scale for that matter if you have a lot of users and diverse data directories. SSE-S3 uses only one encryption key and does not enable granular permissions. Identity federation would not help either to solve that problem, as it does not define an authorization model. SSE-KMS will allow you to use different KMS keys to encrypt the objects, and then you can grant users access to specific sets of KMS keys to give them access to the objects in S3 they should be able to decrypt.",
<p>Which are the two technologies that support VPC Endpoint Gateway? (select two)</p>,multi-select,<p>SQS</p>,<p>DynamoDB</p>,<p>S3</p>,<p>CloudFormation</p>,<p>SNS</p>,,"2,3","DynamoDB & S3 are the only technologies that have VPC Endpoint Gateways, the rest are VPC Endpoint Interfaces. ",
