<p>You are launching an EMR cluster and plan on running custom python scripts that will end up invoking custom Lambda functions deployed within your VPC. How can you ensure the EMR cluster has the right to invoke the functions?</p>,multiple-choice,<p>Create an IAM user and put the credentials into the ~/.aws/credentials file</p>,<p>Create an AWS Lambda policy and authorize the EMR cluster security groups</p>,<p>Create an IAM role and attach it to the EMR instances</p>,<p>Attach a VPC Endpoint to Lambda and map a route to EMR</p>,,,3,"As EMR is made of EC2 instances, the best and most secure way for them to be allowed to invoke a Lambda function is to attach IAM roles. There’s no Lambda policy or VPC Endpoint that can help for that matter. ",
<p>A user or application has been changing configuration on your production S3 bucket and you would like to understand who did this. What do you recommend?</p>,multiple-choice,<p>Analyze the S3 access logs with Athena</p>,<p>Use CloudTrail</p>,<p>Use the IAM action logs</p>,<p>Write a custom S3 bucket policy</p>,,,2,"Very simply, we’re looking at searching through API calls done on your account, which CloudTrail was made for.",
<p>Your esports application hosted on AWS need to process game results immediately in real time and later perform analytics on the same game results in the order they came at the end of business hours. Which of the AWS service will be the best fit for your needs?</p>,multiple-choice,<p>SQS FIFO Queues</p>,<p>SQS Standard Queues</p>,<p>DynamoDB</p>,<p>Kinesis Data Streams</p>,,,4,"Here Kinesis is the best fit as the data can be replayed in the same order. SQS does not allow data replays, and DynamoDB would allow to replay some data, but it’d be different to get some ordering constraints working as well as well as enable real time use cases.",
"<p>Of the 4 four types of identity principals for authentication supported by AWS IoT, which one is commonly used by mobile applications?</p>",multiple-choice,<p>Cognito Identities</p>,"<p>IAM users, groups and roles</p>",<p>X.509 certificates</p>,<p>Federated Identities</p>,,,1,"For IoT mobile applications, the standard is to leverage Cognito.",
"<p>You have programmed a Lambda function that will be automating the creation of an EMR cluster, which in turn should perform some transformations in S3 through EMRFS. Your Lambda function will be triggered by CloudWatch Events. How can you ensure your Lambda function can properly perform its actions?</p>",multiple-choice,<p>Attach an IAM user</p>,<p>Attach an IAM role</p>,<p>Deploy in a VPC</p>,<p>Use a Lambda policy</p>,,,2,"As the Lambda function will be performing API calls on our infrastructure, it needs to have an IAM role attached. Deploying it in a VPC won’t help, and we can’t create users for Lambda functions. ",
"<p>You are working for a data warehouse company that uses Amazon RedShift cluster. For security reasons, it is required that VPC flow logs should be analyzed by Athena to monitor all COPY and UNLOAD traffic of the cluster that moves in and out of the VPC. Which of the following helps you in this regard ?</p>",multiple-choice,<p>Use Redshift Spectrum</p>,<p>Use Redshift WLM</p>,<p>By enabling audit logging in Redshift cluster</p>,<p>Use Enhanced VPC Routing</p>,,,4,"Enhanced VPC Routing forces Redshift to use the VPC for all COPY and UNLOAD commands, which in turn will help us make sure that all that traffic appears on the VPC Flow logs. ",
"<p>You are using an EMR cluster to perform a series of Hive jobs that quickly read and write data to and from S3. When you were running these steps manually through the Hue UI, all worked, but as soon as you automated the steps to run immediately one after the other, the queries were producing results with old data. Upon checking S3, you were able to see the new data was written. What should you do to fix the issue?</p>",multiple-choice,<p>Use Hive consistent write mode to S3</p>,<p>Enable EMRFS</p>,<p>Add an S3 bucket policy to prevent overwrites</p>,<p>Enable S3 versioning</p>,,,2,"S3 has eventually consistent properties, and to fix the problems this might imply in EMR, you need to enable EMRFS. ",
